### ISSUE TITLE
examples/clock: works with Firefox but not Chrome

### ISSUE THREAD

**Issue by candlerb** [jfyne/live#25]
## Environment

go version go1.16.5 darwin/amd64
macOS 10.14.6
chrome 91.0.4472.164
firefox 90.0.1

## To replicate

```
git clone git@github.com:jfyne/live-examples.git
cd live-examples/clock
go build .
cd ..
clock/clock
```

Point browser at <http://localhost:8080/clock>

## What I expected

Incrementing clock

## What I saw

With Firefox, everything is OK.

With Chrome, current time is displayed, but does not increment.

tcpdump shows that websocket messages *are* being sent every second:

```
$ sudo tcpdump -i lo0 -nn -s0 -A tcp port 8080
...
08:47:28.831040 IP6 ::1.8080 > ::1.50406: Flags [P.], seq 1:269, ack 810, win 6359, options [nop,nop,TS val 1005537220 ecr 1005537219], length 268: HTTP: HTTP/1.1 101 Switching Protocols
`....,.@.....................................p.#...v.....4.....
;.G.;.G.HTTP/1.1 101 Switching Protocols
Connection: Upgrade
Sec-Websocket-Accept: J1GHBBuREgeNFGWhZQUIYbi8YQ4=
Sec-Websocket-Extensions: permessage-deflate; client_no_context_takeover; server_no_context_takeover
Upgrade: websocket
Date: Thu, 22 Jul 2021 07:47:28 GMT


08:47:28.831077 IP6 ::1.50406 > ::1.8080: Flags [.], ack 269, win 6367, options [nop,nop,TS val 1005537220 ecr 1005537220], length 0
`..f. .@.......................................v.p /.....(.....
;.G.;.G.
08:47:28.831177 IP6 ::1.8080 > ::1.50406: Flags [P.], seq 269:288, ack 810, win 6359, options [nop,nop,TS val 1005537220 ecr 1005537220], length 19: HTTP
`....3.@.....................................p /...v.....;.....
;.G.;.G...{"t":"connect"}..
08:47:28.831197 IP6 ::1.50406 > ::1.8080: Flags [.], ack 288, win 6367, options [nop,nop,TS val 1005537220 ecr 1005537220], length 0
`..f. .@.......................................v.p B.....(.....
;.G.;.G.
08:47:29.834266 IP6 ::1.8080 > ::1.50406: Flags [P.], seq 288:471, ack 810, win 6359, options [nop,nop,TS val 1005538221 ecr 1005537220], length 183: HTTP
`......@.....................................p B...v...........
;.K.;.G..~..{"t":"patch","d":[{"Path":[0,0],"Action":2,"HTML":"\u003ctitle\u003e 08:47:29 \u003c/title\u003e"},{"Path":[1,0],"Action":2,"HTML":"\u003ctime\u003e08:47:29\u003c/time\u003e"}]}..
08:47:29.834302 IP6 ::1.50406 > ::1.8080: Flags [.], ack 471, win 6364, options [nop,nop,TS val 1005538221 ecr 1005538221], length 0
`..f. .@.......................................v.p ......(.....
;.K.;.K.
08:47:30.839156 IP6 ::1.8080 > ::1.50406: Flags [P.], seq 471:654, ack 810, win 6359, options [nop,nop,TS val 1005539224 ecr 1005538221], length 183: HTTP
`......@.....................................p ....v...........
;.O.;.K..~..{"t":"patch","d":[{"Path":[0,0],"Action":2,"HTML":"\u003ctitle\u003e 08:47:30 \u003c/title\u003e"},{"Path":[1,0],"Action":2,"HTML":"\u003ctime\u003e08:47:30\u003c/time\u003e"}]}..
08:47:30.839203 IP6 ::1.50406 > ::1.8080: Flags [.], ack 654, win 6361, options [nop,nop,TS val 1005539224 ecr 1005539224], length 0
`..f. .@.......................................v.p!......(.....
;.O.;.O.
08:47:31.842699 IP6 ::1.8080 > ::1.50406: Flags [P.], seq 654:837, ack 810, win 6359, options [nop,nop,TS val 1005540226 ecr 1005539224], length 183: HTTP
`......@.....................................p!....v...........
;.S.;.O..~..{"t":"patch","d":[{"Path":[0,0],"Action":2,"HTML":"\u003ctitle\u003e 08:47:31 \u003c/title\u003e"},{"Path":[1,0],"Action":2,"HTML":"\u003ctime\u003e08:47:31\u003c/time\u003e"}]}..
08:47:31.842764 IP6 ::1.50406 > ::1.8080: Flags [.], ack 837, win 6358, options [nop,nop,TS val 1005540226 ecr 1005540226], length 0
`..f. .@.......................................v.p"g.....(.....
;.S.;.S.
```

I don't see any errors in browser console, although network shows stuck at "101 Switching Proto..."

![image](https://user-images.githubusercontent.com/44789/126606584-0f254dd6-6fe8-4c50-82da-7065d22d50d3.png)

## Additional info

With both Chrome and Firefox, closing the browser tab logs the following at the server side:

```
2021/07/22 08:47:01 ws closed with status (-1): writing to socket error: failed writeTimeout: json: error calling MarshalJSON for type json.RawMessage: invalid character 'i' in literal false (expecting 'l')
```

**Comment by jfyne** [comment]
I can't replicate this although sometimes I see something similar happening in Firefox. I will keep trying

**Comment by AnaelBerrouet** [comment]
Just to bump this. I'm not sure if I should create an additional issue. But I am seeing a failures for buttons as well. Following nearly identical process I ran buttons on chrome and inc and dec are throwing error client side: 
`patch.ts:35 unhandled patch, path target undefined`
